{"$id": "https://capsula.invalid/schema/canister.schema.json", "$schema": "https://json-schema.org/draft/2020-12/schema", "additionalProperties": false, "description": "Describes one browser-loadable WASM canister: the WASM core plus the weight shards the page must download. Mechanics scaffolding \u2014 validation only, no real weights implied.", "properties": {"id": {"description": "Stable canister id, e.g. \"avatar-phone\". Used in cache keys.", "minLength": 1, "type": "string"}, "memory": {"additionalProperties": false, "description": "Optional WebAssembly.Memory hints for the core.", "properties": {"initialPages": {"minimum": 1, "type": "integer"}, "maximumPages": {"minimum": 1, "type": "integer"}}, "type": "object"}, "name": {"description": "Human-readable name.", "minLength": 1, "type": "string"}, "version": {"description": "Semver. Bumping the version busts the browser weight cache.", "pattern": "^\\d+\\.\\d+\\.\\d+(-[0-9A-Za-z.-]+)?$", "type": "string"}, "wasmSha256": {"description": "Hex SHA-256 of the exact WASM bytes. The worker refuses to instantiate on mismatch.", "pattern": "^[0-9a-fA-F]{64}$", "type": "string"}, "wasmUrl": {"description": "URL of the WASM core. Absolute URLs must be https:, except plain http: on localhost/127.0.0.1 (dev only). Relative URLs are same-origin.", "minLength": 1, "type": "string"}, "weights": {"description": "Weight shards, downloaded in order. Shard granularity is the resume unit.", "items": {"additionalProperties": false, "properties": {"bytes": {"minimum": 1, "type": "integer"}, "name": {"minLength": 1, "type": "string"}, "sha256": {"pattern": "^[0-9a-fA-F]{64}$", "type": "string"}, "url": {"minLength": 1, "type": "string", "description": "Shard URL. Same rule as wasmUrl: absolute must be https: except http: on localhost/127.0.0.1."}}, "required": ["name", "url", "bytes", "sha256"], "type": "object"}, "minItems": 1, "type": "array"}}, "required": ["id", "name", "version", "wasmUrl", "wasmSha256", "weights"], "title": "Capsula Canister Manifest", "type": "object"}