{"id":"demo-synth","memory":{"initialPages":1,"maximumPages":16},"name":"Synthetic demo core (mechanics only)","version":"0.0.0-demo","wasmSha256":"5a177367a825dc91036435fd47382ad1cd3fb229937b3aaf49f61f1a075486c1","wasmUrl":"https://r2-weights.example.invalid/wasm/demo-synth/0.0.0-demo/core.wasm","weights":[{"bytes":2048,"name":"shard-0.bin","sha256":"7c7272c96bd53928d659650ce0d351531ccca5b7ce618d14f48ec5c8ffd4919f","url":"https://r2-weights.example.invalid/weights/demo-synth/0.0.0-demo/shard-0.bin"}]}